{"outer_envelope_schema":"schemas/story-construction/precontent-activation-closeout-envelope-v2.schema.json","payload":{"change_set_id":"CS-SCG-PRECONTENT-READINESS-R1-001","defect_id":"SCG-PRE-B002-AUTHORITATIVE-EFFECT-EXTERNAL-PROOF-INTERFACE-MISSING-001","fixed_lineage":{"base_commit":"6f9f671401f5857d460ca8e0bd8a86ebe04bb0b6","base_tree":"2dfa6553770f4eedbb4def358f661b9b16b79a4d","defective_activation_commit":"d80aae8d1dfede85d91ff0367f4c6a18d62bb2a7","defective_activation_parent":"74fecbe6984f150f83c364e5d5a5850132cfc147","defective_activation_tree":"f6e5eaabd5bcbc66666d54f2cb389f2c96e643c0","implementation_commit":"74fecbe6984f150f83c364e5d5a5850132cfc147","implementation_tree":"b81fa075a1b812478dbc3e196429c7392279e28f"},"fixed_preservation":{"canon_hash":"d7ceea75615b57970f3b9712b73ed4c9f65a9c4406c877e9013470cb53a6141a","decision_set_hash":"0e01181acbc9fb95c57ed1b910a3b561545e8824f0c60d7fdc35c93cff44146d","m2_plan_hash":"74da7cc866e0b3b1f3580d86df18c8c6d9724ff6131e5d35c155fc33a2f71c17","m2_state":"M2_B001_ACCEPTED_WITH_DOWNSTREAM_BLOCKERS_B002_NOT_STARTED","partial_supersession_hash":"45bcd35ef9c18dea5e300c163ef232692a77b42ea9b11d9b555df118f74206da","provider_contract_set_hash":"dc1a5b37bc42f0d9f97ceac9f34460138009a79499304ac1844ef77e21ceb3e5","provider_zero_call_evidence_hash":"e6536a180aeb21b20ca9b65594610e65c50d72bf388b513533bed799366214f5","q001_q130_hash":"01fdebbd338a8abdbc0226d0290b1bc2b02366cb615a22182f0df0a5f75fa7b2","runtime_package_sha256":"29ea1e0278e37d183d4c0ff396437088b4873c58c5e9a9c857093f6c552a6314","traceability_hash":"a0ed82836894d8d809447aa0b5d8cb8a05dfff87b363701b719de68f90b8359a"},"framework_manifests":{"r1":{"file_sha256":"891944f172236b666eb78bc641f4e7ecabf6ec3e318ab4cd0b5858f045b06b67","merkle_root":"87c6520fe0822e29312de6c72cad95f0849aa3d0bd4fbb27f97f1f786027bf8f","path":"governance/story-construction/precontent/manifests/framework-manifest.r1.json","record_count":68},"r2":{"file_sha256":"43346ea1c462cc70d2c1e4855351d111e9f6cfa263a7aeca6f5821d4d3a00a8f","merkle_root":"5c272518a3acd983bc8b5cea5290f77ec5da15f291baac7ade39fd32d699aeea","path":"governance/story-construction/precontent/manifests/framework-manifest.r2.json","record_count":76},"r3":{"file_sha256":"836fbaf57137d31429e5f54aa52035edc10c2768480c73ab9e55631cbcc2cae4","merkle_root":"48d8a22fed2142228d2ca5233ff894f0e3cb182fa1899ce73af8366d45078474","path":"governance/story-construction/precontent/manifests/framework-manifest.r3.json","record_count":81,"semantic_path_content_record_set_hash":"3f6071050644d5fe4cbfc39fc689383f55c9d874f7af87d9aecdf639ea4bd0ab"}},"historical_activation":{"accept_result":"PASS_FIXED_M3_B002_ACTIVATION_CANDIDATE_ACCEPTED","accept_route":"SCG-PRECONTENT-M3-B002-ACTIVATION-CLOSEOUT-ACCEPT","accept_route_digest":"5aee4ad9bf88bded6529820ca3a70ad8f2843cd0cad1990404647fce6d1dcdcf","accept_verifier":"CODEX-INDEPENDENT-VERIFIER-SCG-PRECONTENT-M3-B002-ACTIVATION-CLOSEOUT-ACCEPT-001","approval_canonical_sha256":"df75a91874a816b47c9772190e858ec6b0890e7b70e809fa7210c69bbee1812c","approval_id":"OWNER-APPROVAL-SCG-PRECONTENT-M3-B002-ACTIVATION-CANDIDATE-D80AAE8D-R1","approval_issued_consumed":false,"approval_raw_sha256":"df75a91874a816b47c9772190e858ec6b0890e7b70e809fa7210c69bbee1812c","authoritative_effect_established":false,"consumed_by_accept_task":"SCG-PRECONTENT-M3-B002-ACTIVATION-CLOSEOUT-ACCEPT-001","consumption_count":1,"single_use":true,"transferable":false},"machine_batch_id":"M3-B002","machine_milestone":"M3","manifest_model":"MODEL_R3_ADDITIVE","provider_request_counts":{"deepseek":0,"grok":0,"opencode":0,"story_m0":0},"r3_transition":{"changed_old_count":6,"changed_old_leaf_transition_hash":"91b5ae24588367dfb09359f6d531b8863fda54e2e74fee0abb4e3ebd99c915c5","new_leaf_set_hash":"2f2979340c70d6f1421bcfe01ad88b4aff2d90a73380aefe73dc76ddffc9ab71","new_record_count":5,"old_record_count":76,"r2_leaf_set_hash":"5412098396d68825a10a18b2128dbd46e54209d1e355f2a2a7f3f5e2c936cbf7","r3_leaf_set_hash":"3f6071050644d5fe4cbfc39fc689383f55c9d874f7af87d9aecdf639ea4bd0ab","total_record_count":81,"unchanged_old_count":70,"unchanged_old_leaf_set_hash":"0d4fb9ce25f09340102d3db8b66fa85a1e90e8013e634f530bc946cc86d1871d"},"receipt_id":"SCG-PRECONTENT-READINESS-R3-FINAL-001","receipt_status":"PENDING_OWNER_AUTHORITATIVE_EFFECT_REPAIR_HASH_APPROVAL_M3_B002","repair_path_allowlist":{"path_count":13,"sha256":"cd142235a3ecc660ade277efc0a99d2e3799456786062fb098530a864c9bbeca"},"repair_task_id":"SCG-PRECONTENT-M3-B002-AUTHORITATIVE-EFFECT-REPAIR-IMPLEMENT-001","schema_sets":{"combined_schema_count":28,"combined_schema_set_hash":"c26c1a568f3f74346bbca6f7f56c4e359406d04aeadc4ee9259e8e91d5ef4ef6","original_schema_count":20,"original_schema_set_hash":"77c8d831c2fd4b79edc597215135ca111fd76b1e00b9d126fda5a4d1a7fcdc50","preserved_activation_v1_schema_count":5,"preserved_activation_v1_schema_set_hash":"86d86a286fd1bbd3810720b943d61c1e00c3a63c9e6aed714f6e40d072b90b7f","repair_schema_count":3,"repair_schema_set_hash":"4823a2a02676d001e8840961747dc3f36e8535ea148271930ebbee99bdb61592"},"schema_version":"rules-residue.story-construction.precontent-final-receipt/3.0.0","tracked_state":{"active_wip":true,"authoritative_activation_effective":false,"disposition":"ACTIVE","lifecycle_stage":"APPROVED","release":"NOT_RELEASED","tracked_target_state":"TRACKED_B002_TARGET_STATE_ACTIVE"}},"payload_hash":"d793b0aa4d84acfbc94fe41f4980e41a282e9ef5dc9110344f9053f9999aadc7","receipt_kind":"TRACKED_INNER_AUTHORITATIVE_EFFECT_REPAIR_RECEIPT","schema_version":"rules-residue.story-construction.precontent-final-receipt/3.0.0"}
